{
  "version": "1.0.0",
  "generatedNote": "Registry tool AI Layer Simple ERP. Single source of truth mapping function (tool AI) -> endpoint ERP + kontrol izin. Tambah fitur baru = tambah 1 objek ke array 'tools', lalu jalankan validate-registry.mjs. Disusun dari audit kode (server/src/routes + services + constants/modules.ts).",
  "modules": [
    "sales_order", "delivery_order", "sales_invoice", "quotation", "sales_return", "customer_deposit",
    "purchase_order", "goods_receipt", "purchase_invoice", "vendor_deposit",
    "inventory", "stock_transfer", "stock_opname", "production", "warehouse",
    "payment", "reconciliation", "recurring", "project_guarantee",
    "coa", "journal", "fixed_assets", "approvals",
    "ga_assets", "ga_vehicle", "ga_building", "ga_equipment", "ga_maintenance", "ga_inventory", "ga_documents", "ga_master",
    "reports", "parties", "settings", "users", "audit"
  ],
  "capabilities": [
    "doc.cancel", "approval.decide", "approval.bypass", "approval.view_all", "inventory.negative_stock", "rbac.manage"
  ],
  "tools": [
    { "name": "so_list", "group": "Penjualan", "module": "sales_order", "kind": "read", "tier": "auto", "method": "GET", "path": "/sales-orders", "permAction": "view", "summary": "Daftar Sales Order", "phase": 3, "enabled": false },
    { "name": "so_get", "group": "Penjualan", "module": "sales_order", "kind": "read", "tier": "auto", "method": "GET", "path": "/sales-orders/:id", "permAction": "view", "summary": "Detail satu Sales Order", "phase": 3, "enabled": false },
    { "name": "so_create", "group": "Penjualan", "module": "sales_order", "kind": "action", "tier": "must_approve", "method": "POST", "path": "/sales-orders", "permAction": "edit", "summary": "Buat Sales Order baru", "phase": 3, "enabled": false },
    { "name": "so_submit", "group": "Penjualan", "module": "sales_order", "kind": "action", "tier": "must_approve", "method": "POST", "path": "/sales-orders/:id/submit", "permAction": "edit", "summary": "Submit Sales Order", "phase": 3, "enabled": false },
    { "name": "so_generate_do", "group": "Penjualan", "module": "sales_order", "kind": "action", "tier": "must_approve", "method": "POST", "path": "/sales-orders/:id/generate-do", "permAction": "edit", "summary": "Buat Surat Jalan dari SO", "phase": 3, "enabled": false },
    { "name": "so_cancel", "group": "Penjualan", "module": "sales_order", "kind": "action", "tier": "must_approve", "method": "POST", "path": "/sales-orders/:id/cancel", "permAction": "edit", "requiresCapability": "doc.cancel", "summary": "Batalkan Sales Order", "phase": 3, "enabled": false },

    { "name": "do_list", "group": "Penjualan", "module": "delivery_order", "kind": "read", "tier": "auto", "method": "GET", "path": "/delivery-orders", "permAction": "view", "summary": "Daftar Surat Jalan", "phase": 3, "enabled": false },
    { "name": "do_pending", "group": "Penjualan", "module": "delivery_order", "kind": "read", "tier": "auto", "method": "GET", "path": "/delivery-orders/pending", "permAction": "view", "summary": "Surat Jalan menunggu", "phase": 3, "enabled": false },
    { "name": "do_create", "group": "Penjualan", "module": "delivery_order", "kind": "action", "tier": "must_approve", "method": "POST", "path": "/delivery-orders", "service": "deliveryOrderSubmit", "permAction": "edit", "summary": "Buat Surat Jalan", "phase": 3, "enabled": false },
    { "name": "do_from_invoice", "group": "Penjualan", "module": "delivery_order", "kind": "action", "tier": "must_approve", "method": "POST", "path": "/delivery-orders/from-invoice/:invoiceId", "service": "deliveryOrderFromInvoice", "permAction": "edit", "summary": "Buat Surat Jalan dari Invoice", "phase": 3, "enabled": false },
    { "name": "do_cancel", "group": "Penjualan", "module": "delivery_order", "kind": "action", "tier": "must_approve", "method": "POST", "path": "/delivery-orders/:id/cancel", "service": "deliveryOrderCancel", "permAction": "edit", "requiresCapability": "doc.cancel", "summary": "Batalkan Surat Jalan", "phase": 3, "enabled": false },

    { "name": "si_list", "group": "Penjualan", "module": "sales_invoice", "kind": "read", "tier": "auto", "method": "GET", "path": "/sales/invoices", "permAction": "view", "summary": "Daftar Invoice Penjualan", "phase": 3, "enabled": false },
    { "name": "si_get", "group": "Penjualan", "module": "sales_invoice", "kind": "read", "tier": "auto", "method": "GET", "path": "/sales/invoices/:id", "permAction": "view", "summary": "Detail Invoice Penjualan", "phase": 3, "enabled": false },
    { "name": "si_create", "group": "Penjualan", "module": "sales_invoice", "kind": "action", "tier": "must_approve", "method": "POST", "path": "/sales/invoices", "service": "salesInvoiceSubmit", "permAction": "edit", "summary": "Buat Invoice Penjualan (DR Piutang/CR Penjualan)", "phase": 3, "enabled": false },
    { "name": "si_cancel", "group": "Penjualan", "module": "sales_invoice", "kind": "action", "tier": "must_approve", "method": "POST", "path": "/sales/invoices/:id/cancel", "service": "invoiceCancellation", "permAction": "edit", "requiresCapability": "doc.cancel", "summary": "Batalkan Invoice Penjualan", "phase": 3, "enabled": false },

    { "name": "quo_list", "group": "Penjualan", "module": "quotation", "kind": "read", "tier": "auto", "method": "GET", "path": "/quotations", "permAction": "view", "summary": "Daftar Penawaran/Quotation", "phase": 3, "enabled": false },
    { "name": "quo_stats", "group": "Penjualan", "module": "quotation", "kind": "read", "tier": "auto", "method": "GET", "path": "/quotations/stats", "permAction": "view", "summary": "Statistik Quotation", "phase": 3, "enabled": false },
    { "name": "quo_create", "group": "Penjualan", "module": "quotation", "kind": "action", "tier": "draft", "method": "POST", "path": "/quotations", "permAction": "edit", "summary": "Buat Quotation (tanpa efek GL)", "phase": 3, "enabled": false },

    { "name": "sr_list", "group": "Penjualan", "module": "sales_return", "kind": "read", "tier": "auto", "method": "GET", "path": "/sales-returns", "permAction": "view", "summary": "Daftar Retur Penjualan", "phase": 3, "enabled": false },
    { "name": "sr_create", "group": "Penjualan", "module": "sales_return", "kind": "action", "tier": "must_approve", "method": "POST", "path": "/sales-returns", "service": "salesReturnSubmit", "permAction": "edit", "summary": "Buat Retur Penjualan", "phase": 3, "enabled": false },

    { "name": "cd_list", "group": "Penjualan", "module": "customer_deposit", "kind": "read", "tier": "auto", "method": "GET", "path": "/customer-deposits", "permAction": "view", "summary": "Daftar Uang Muka Pelanggan", "phase": 4, "enabled": false },
    { "name": "cd_create", "group": "Penjualan", "module": "customer_deposit", "kind": "action", "tier": "must_approve", "method": "POST", "path": "/customer-deposits", "permAction": "edit", "summary": "Catat Uang Muka Pelanggan", "phase": 4, "enabled": false },

    { "name": "po_list", "group": "Pembelian", "module": "purchase_order", "kind": "read", "tier": "auto", "method": "GET", "path": "/purchase-orders", "permAction": "view", "summary": "Daftar Purchase Order", "phase": 3, "enabled": false },
    { "name": "po_create", "group": "Pembelian", "module": "purchase_order", "kind": "action", "tier": "must_approve", "method": "POST", "path": "/purchase-orders", "service": "purchaseOrderSubmit", "permAction": "edit", "summary": "Buat Purchase Order", "phase": 3, "enabled": false },
    { "name": "po_cancel", "group": "Pembelian", "module": "purchase_order", "kind": "action", "tier": "must_approve", "method": "POST", "path": "/purchase-orders/:id/cancel", "permAction": "edit", "requiresCapability": "doc.cancel", "summary": "Batalkan Purchase Order", "phase": 3, "enabled": false },

    { "name": "gr_list", "group": "Pembelian", "module": "goods_receipt", "kind": "read", "tier": "auto", "method": "GET", "path": "/goods-receipts", "permAction": "view", "summary": "Daftar Penerimaan Barang (BPB/STT)", "phase": 3, "enabled": false },
    { "name": "gr_create", "group": "Pembelian", "module": "goods_receipt", "kind": "action", "tier": "must_approve", "method": "POST", "path": "/goods-receipts", "service": "goodsReceiptSubmit", "permAction": "edit", "summary": "Catat Penerimaan Barang (stok+accrual hutang)", "phase": 3, "enabled": false },
    { "name": "gr_cancel", "group": "Pembelian", "module": "goods_receipt", "kind": "action", "tier": "must_approve", "method": "POST", "path": "/goods-receipts/:id/cancel", "service": "goodsReceiptCancel", "permAction": "edit", "requiresCapability": "doc.cancel", "summary": "Batalkan Penerimaan Barang", "phase": 3, "enabled": false },

    { "name": "pi_list", "group": "Pembelian", "module": "purchase_invoice", "kind": "read", "tier": "auto", "method": "GET", "path": "/purchase/invoices", "permAction": "view", "summary": "Daftar Invoice Pembelian", "phase": 3, "enabled": false },
    { "name": "pi_create", "group": "Pembelian", "module": "purchase_invoice", "kind": "action", "tier": "must_approve", "method": "POST", "path": "/purchase/invoices", "service": "purchaseInvoiceSubmit", "permAction": "edit", "summary": "Buat Invoice Pembelian", "phase": 3, "enabled": false },
    { "name": "pi_revise_price", "group": "Pembelian", "module": "purchase_invoice", "kind": "action", "tier": "must_approve", "method": "POST", "path": "/purchase/invoices/:id/revise-price", "service": "purchaseInvoiceRevise", "permAction": "edit", "summary": "Revisi harga Invoice Pembelian", "phase": 3, "enabled": false },

    { "name": "inv_items", "group": "Stok & Produksi", "module": "inventory", "kind": "read", "tier": "auto", "method": "GET", "path": "/inventory/items", "permAction": "view", "summary": "Daftar item stok", "phase": 1, "enabled": false },